{
  "reference_application_map_version": 1,
  "id": "uibowl-parts-20260922",
  "status": "research-only",
  "audience": [
    "internal-researcher",
    "independent-critic",
    "owner"
  ],
  "orchestrator": "KillSlopRouter",
  "source_pixels_included": false,
  "creator_input_approved": false,
  "visual_authority_granted": false,
  "design_ready": false,
  "rights": {
    "access": "ordinary-public-ui",
    "redistribution": false,
    "creator_pixel_access": false,
    "cross_project_approval_reuse": false,
    "license_grant": false
  },
  "limits": [
    "Original comparative notes about archived real-product UI; no proof of human authorship, popularity, usability or current source implementation.",
    "Eight distinct frames in five products were visually inspected. This is a bounded part study, not an exhaustive search or a globally best shortlist.",
    "Private native-browser screenshots are hash-identified but not shipped. Public readers must reopen permitted source pages; these notes are not export/capture authority.",
    "No source app interaction, mobile layout, contrast ratio, exact CSS token or accessibility result was verified. Qualitative observations are not pixel measurements.",
    "This map is not a reference pack, component recipe, source selection or approval. Project gates, independent reference review and real Owner decisions remain required."
  ],
  "sources": [
    {
      "id": "magnific",
      "name": "Magnific",
      "frames": [
        {
          "id": "cmttckbdm0013kx04kb8voa19",
          "url": "https://uibowl.io/website?patterns=%EA%B2%80%EC%83%89&imgId=cmttckbdm0013kx04kb8voa19",
          "observed_state": "Image-search entry and category grid",
          "capture_digest": "sha256:d24a3cacf5929cfd1c85f819b34ec90c5cc41589ed98fe83968ff4f586131fe6",
          "evidence_kind": "archived-ui-image-visually-inspected",
          "observed_on": "2026-09-22",
          "interaction": "not-executed",
          "responsive": "not-observed",
          "capture_bundled": false
        },
        {
          "id": "cmttckbeb0015kx04dcc9as7f",
          "url": "https://uibowl.io/website?patterns=%EA%B2%80%EC%83%89&imgId=cmttckbeb0015kx04dcc9as7f",
          "observed_state": "Search/upload panel over the category grid",
          "capture_digest": "sha256:e9d00eb46684900911ae41f919154621ebf8a51114bcd86bd01f3e3700244d84",
          "evidence_kind": "archived-ui-image-visually-inspected",
          "observed_on": "2026-09-22",
          "interaction": "not-executed",
          "responsive": "not-observed",
          "capture_bundled": false
        }
      ]
    },
    {
      "id": "cardgorilla",
      "name": "CardGorilla",
      "frames": [
        {
          "id": "cmr360f1y0010jt047oqepqjd",
          "url": "https://uibowl.io/website?imgId=cmr360f1y0010jt047oqepqjd",
          "observed_state": "Populated side-by-side card comparison",
          "capture_digest": "sha256:430a80247f694b8ef7fd9492a4babd3164fadf0c2aa266237f8d47e70a5306c3",
          "evidence_kind": "archived-ui-image-visually-inspected",
          "observed_on": "2026-09-22",
          "interaction": "not-executed",
          "responsive": "not-observed",
          "capture_bundled": false
        },
        {
          "id": "cmr360eyd000qjt04zk847cz7",
          "url": "https://uibowl.io/website?imgId=cmr360eyd000qjt04zk847cz7",
          "observed_state": "Empty comparison with three selection slots",
          "capture_digest": "sha256:eab37b23b341b90bb32506866e65660564916384dc2392772beadd0705ad13d1",
          "evidence_kind": "archived-ui-image-visually-inspected",
          "observed_on": "2026-09-22",
          "interaction": "not-executed",
          "responsive": "not-observed",
          "capture_bundled": false
        }
      ]
    },
    {
      "id": "clarity",
      "name": "Microsoft Clarity",
      "frames": [
        {
          "id": "cmt17w3iw001fjy04fiwqu9a6",
          "url": "https://uibowl.io/website?imgId=cmt17w3iw001fjy04fiwqu9a6",
          "observed_state": "Dashboard with filters, metric panels and a local empty state",
          "capture_digest": "sha256:9d353ed33221a607db08b5d33440d7c89db669e8c12855a5887533b3daa6db0d",
          "evidence_kind": "archived-ui-image-visually-inspected",
          "observed_on": "2026-09-22",
          "interaction": "not-executed",
          "responsive": "not-observed",
          "capture_bundled": false
        }
      ]
    },
    {
      "id": "clovanote",
      "name": "ClovaNote",
      "frames": [
        {
          "id": "cmpnujssg000dlb04d6sfajqk",
          "url": "https://uibowl.io/website/%ED%81%B4%EB%A1%9C%EB%B0%94%EB%85%B8%ED%8A%B8?imgId=cmpnujssg000dlb04d6sfajqk",
          "observed_state": "Transcript and grouped summary side by side",
          "capture_digest": "sha256:92299e2d03040afffdb31bf70f104128a2e93c170921430b14eef89156c3591e",
          "evidence_kind": "archived-ui-image-visually-inspected",
          "observed_on": "2026-09-22",
          "interaction": "not-executed",
          "responsive": "not-observed",
          "capture_bundled": false
        }
      ]
    },
    {
      "id": "facticity",
      "name": "Facticity.AI",
      "frames": [
        {
          "id": "cmi7e3sgu000bl504ahcdkudz",
          "url": "https://uibowl.io/website/Facticity.AI?imgId=cmi7e3sgu000bl504ahcdkudz",
          "observed_state": "Source media beside selectable extracted claims",
          "capture_digest": "sha256:bc5bc96cfacdf8918b5abacbc389628ab58eaf9b2a6984140f3c4e831c381337",
          "evidence_kind": "archived-ui-image-visually-inspected",
          "observed_on": "2026-09-22",
          "interaction": "not-executed",
          "responsive": "not-observed",
          "capture_bundled": false
        },
        {
          "id": "cmi7e3skq000jl504it0ys9ct",
          "url": "https://uibowl.io/website/Facticity.AI?imgId=cmi7e3skq000jl504it0ys9ct",
          "observed_state": "Claim explanation and source-summary cards beside the source media",
          "capture_digest": "sha256:af2b46a64e85e627f934545edf700ad3557f5104bc865bbc4e9e2b845f93e62c",
          "evidence_kind": "archived-ui-image-visually-inspected",
          "observed_on": "2026-09-22",
          "interaction": "not-executed",
          "responsive": "not-observed",
          "capture_bundled": false
        }
      ]
    }
  ],
  "search_record": {
    "method": "Task-led ordinary UI Bowl browsing, public taxonomy/search and reopening dated frame leads. No hidden endpoint, MCP, scraper, account switch or membership bypass.",
    "comparisons": [
      "ClovaNote versus Facticity: continuous original/summary reading versus per-claim explanation and source relationships; neither establishes a complete knowledge-search product.",
      "Magnific versus Facticity: visual category discovery versus evidence-bearing results; vivid media is useful only when media is the task object.",
      "Clarity versus CardGorilla: operational overview versus attribute-by-attribute choice; dashboard tiles must not replace comparable rows."
    ],
    "excluded_leads": [
      {
        "url": "https://uibowl.io/website/Perplexity%20(%ED%8D%BC%ED%94%8C%EB%A0%89%EC%8B%9C%ED%8B%B0)?imgId=cmr1evx410029jp04pbpmwhia",
        "reason": "Only a scheduling-entry preview was inspected; task mismatch and insufficient fine-craft visibility. Not counted as a studied transferable frame."
      },
      {
        "url": "https://uibowl.io/website?imgId=cmt17vmck00qhl504uxthpwi4",
        "reason": "No enlarged source image loaded in the current visit; historical popover notes are not fresh evidence."
      }
    ],
    "stop_reason": "Bounded desktop part mapping is documented. Stop before claiming a project shortlist: mobile, focus/error states and end-to-end search/reading still require targeted acquisition.",
    "remaining_gaps": [
      "same-product-mobile",
      "source-app-interaction",
      "keyboard-focus-error-loading",
      "end-to-end-knowledge-search",
      "mobile-news-reading",
      "public-access"
    ]
  },
  "shared_rules": [
    "Choose a product-fit whole-screen anchor separately. Supporting sources answer a named part need; they never each supply a competing theme.",
    "Normalize borrowed principles into the project's authorized typography, spacing, color roles, radii, elevation and density. Do not impose gray/editorial neutrality or copy source literals.",
    "Keep hierarchy relational: primary task before embellishment, data before decorative counters, visible provenance before unsupported confidence.",
    "For every target component record adopted cues, deliberate differences, states and reflow, then compare the implemented artifact to that specification.",
    "Owner source/direction/color/exact-artifact decisions are distinct. Research notes and browser passes cannot grant any of them.",
    "Only the existing source-separated, aliased grammar/recipe projection may reach a creator; this named map is researcher/critic/Owner material."
  ],
  "parts": [
    {
      "id": "query-entry",
      "label": "검색 진입",
      "job": "Choose search scope and enter a query without losing the surrounding task.",
      "coverage": "bounded-study",
      "observations": [
        {
          "frame_id": "cmttckbdm0013kx04kb8voa19",
          "facts": [
            "A wide search control sits above a low-emphasis category grid; small colorful category images carry much of the visual energy.",
            "The search control has a rounded outline and compact icons; category cards pair a rounded thumbnail with a short dark label on a pale fill rather than a loud colored card."
          ]
        },
        {
          "frame_id": "cmttckbeb0015kx04dcc9as7f",
          "facts": [
            "A white bounded panel separates a narrow mode list from a larger input/upload area while the category grid remains visible behind it.",